{
  "base": "ghcr.io/test-owner/test-repo",
  "owner": "test-owner",
  "packages": {
    "org.hkijena.jipipe_python_adapter:0.3.0-*": {
      "description": "Python Adapter for JIPipe",
      "homepage": "https://github.com/applied-systems-biology/jipipe",
      "includes": {},
      "license": "MIT",
      "maintainer": {
        "email": "ruman.gerst@leibniz-hki.de",
        "name": "Ruman Gerst"
      },
      "name": "jipipe_python_adapter",
      "query": "org.hkijena.jipipe_python_adapter:0.3.0-*",
      "sources": [
        {
          "oci-ref": "ghcr.io/applied-systems-biology/jipipe/artifacts/org/hkijena/jipipe_python_adapter",
          "rel": "artifacts/org/hkijena/jipipe_python_adapter",
          "repo": "ghcr",
          "type": "oras"
        }
      ],
      "tags": [
        "0.3.0-any"
      ],
      "updated": "2025-09-27T22:23:08Z",
      "version": "0.3.0"
    },
    "org.python.python_prepackaged:3.10.15.1000-*": {
      "description": "Standalone Python distribution",
      "homepage": "https://github.com/applied-systems-biology/jipipe",
      "includes": {
        "pip": [
          "asciitree==0.3.3",
          "contourpy==1.3.0",
          "cycler==0.12.1",
          "fasteners==0.19",
          "filelock==3.13.1",
          "fonttools==4.53.1",
          "fsspec==2024.2.0",
          "imageio==2.35.1",
          "Jinja2==3.1.3",
          "joblib==1.4.2",
          "kiwisolver==1.4.7",
          "lazy_loader==0.4",
          "looseversion==1.3.0",
          "MarkupSafe==2.1.5",
          "matplotlib==3.9.2",
          "mpmath==1.3.0",
          "networkx==3.3",
          "numcodecs==0.13.0",
          "numpy==2.1.1",
          "opencv-python==4.10.0.84",
          "packaging==24.1",
          "pandas==2.2.2",
          "patsy==0.5.6",
          "pillow==10.4.0",
          "plotly==5.24.1",
          "Pygments==2.18.0",
          "pyparsing==3.1.4",
          "python-dateutil==2.9.0.post0",
          "pytz==2024.2",
          "PyYAML==6.0.2",
          "scikit-image==0.24.0",
          "scikit-learn==1.5.2",
          "scipy==1.14.1",
          "seaborn==0.13.2",
          "SimpleITK==2.4.0",
          "six==1.16.0",
          "statsmodels==0.14.3",
          "sympy==1.12",
          "tenacity==9.0.0",
          "threadpoolctl==3.5.0",
          "tifffile==2024.8.30",
          "torch==2.4.1+cpu",
          "torchaudio==2.4.1+cpu",
          "torchvision==0.19.1+cpu",
          "trackpy==0.6.4",
          "typing_extensions==4.12.2",
          "tzdata==2024.1",
          "vedo==2024.5.2",
          "vtk==9.3.1",
          "zarr==2.18.3"
        ]
      },
      "license": "MPL-2.0",
      "maintainer": {
        "email": "ruman.gerst@leibniz-hki.de",
        "name": "Ruman Gerst"
      },
      "name": "python_prepackaged",
      "query": "org.python.python_prepackaged:3.10.15.1000-*",
      "sources": [
        {
          "oci-ref": "ghcr.io/applied-systems-biology/jipipe/artifacts/org/python/python_prepackaged",
          "rel": "artifacts/org/python/python_prepackaged",
          "repo": "ghcr",
          "type": "oras"
        }
      ],
      "tags": [
        "3.10.15.1000-linux_amd64",
        "3.10.15.1000-macos_amd64",
        "3.10.15.1000-macos_arm64",
        "3.10.15.1000-windows_amd64"
      ],
      "updated": "2025-09-27T22:23:08Z",
      "version": "3.10.15.1000"
    },
    "org.python.python_prepackaged:3.8-*": {
      "description": "Standalone Python distribution",
      "homepage": "https://github.com/applied-systems-biology/jipipe",
      "includes": {
        "pip": [
          "imageio==2.19.3",
          "joblib==1.1.0",
          "networkx==2.8.4",
          "numpy==1.23.1",
          "packaging==21.3",
          "Pillow==9.2.0",
          "pyparsing==3.0.9",
          "python-dateutil==2.8.2",
          "pytz==2022.1",
          "PyWavelets==1.3.0",
          "scikit-image==0.19.3",
          "scikit-learn==1.1.1",
          "scipy==1.8.1",
          "six==1.16.0",
          "threadpoolctl==3.1.0",
          "tifffile==2022.5.4"
        ]
      },
      "license": "MPL-2.0",
      "maintainer": {
        "email": "ruman.gerst@leibniz-hki.de",
        "name": "Ruman Gerst"
      },
      "name": "python_prepackaged",
      "query": "org.python.python_prepackaged:3.8-*",
      "sources": [
        {
          "oci-ref": "ghcr.io/applied-systems-biology/jipipe/artifacts/org/python/python_prepackaged",
          "rel": "artifacts/org/python/python_prepackaged",
          "repo": "ghcr",
          "type": "oras"
        }
      ],
      "tags": [
        "3.8-linux_amd64",
        "3.8-macos_amd64",
        "3.8-windows_amd64"
      ],
      "updated": "2025-09-27T22:23:08Z",
      "version": "3.8"
    },
    "org.r.r_prepackaged:4.1.2-*": {
      "description": "Standalone R distribution",
      "homepage": "https://github.com/applied-systems-biology/jipipe",
      "includes": {},
      "license": "GPL-3",
      "maintainer": {
        "email": "ruman.gerst@leibniz-hki.de",
        "name": "Ruman Gerst"
      },
      "name": "r_prepackaged",
      "query": "org.r.r_prepackaged:4.1.2-*",
      "sources": [
        {
          "oci-ref": "ghcr.io/applied-systems-biology/jipipe/artifacts/org/r/r_prepackaged",
          "rel": "artifacts/org/r/r_prepackaged",
          "repo": "ghcr",
          "type": "oras"
        }
      ],
      "tags": [
        "4.1.2-windows_amd64"
      ],
      "updated": "2025-09-27T22:23:08Z",
      "version": "4.1.2"
    },
    "org.r.r_prepackaged:4.4.0-*": {
      "description": "Standalone R distribution",
      "homepage": "https://github.com/applied-systems-biology/jipipe",
      "includes": {},
      "license": "GPL-3",
      "maintainer": {
        "email": "ruman.gerst@leibniz-hki.de",
        "name": "Ruman Gerst"
      },
      "name": "r_prepackaged",
      "query": "org.r.r_prepackaged:4.4.0-*",
      "sources": [
        {
          "oci-ref": "ghcr.io/applied-systems-biology/jipipe/artifacts/org/r/r_prepackaged",
          "rel": "artifacts/org/r/r_prepackaged",
          "repo": "ghcr",
          "type": "oras"
        }
      ],
      "tags": [
        "4.4.0-linux_amd64_wine",
        "4.4.0-macos_amd64_wine",
        "4.4.0-windows_amd64"
      ],
      "updated": "2025-09-27T22:23:08Z",
      "version": "4.4.0"
    },
    "org.r.r_prepackaged:4.4.0.1000-*": {
      "description": "Standalone R distribution",
      "homepage": "https://github.com/applied-systems-biology/jipipe",
      "includes": {
        "cran": [
          "abind",
          "askpass",
          "backports",
          "base64enc",
          "bit",
          "bit64",
          "blob",
          "brio",
          "broom",
          "bslib",
          "cachem",
          "callr",
          "car",
          "carData",
          "caret",
          "cellranger",
          "cli",
          "clipr",
          "clock",
          "colorspace",
          "conflicted",
          "cpp11",
          "crayon",
          "curl",
          "data.table",
          "DBI",
          "dbplyr",
          "desc",
          "diagram",
          "dials",
          "DiceDesign",
          "diffobj",
          "digest",
          "doFuture",
          "dplyr",
          "dtplyr",
          "e1071",
          "ellipsis",
          "evaluate",
          "fansi",
          "farver",
          "fastmap",
          "fontawesome",
          "forcats",
          "foreach",
          "fs",
          "furrr",
          "future",
          "future.apply",
          "gargle",
          "generics",
          "ggforce",
          "ggplot2",
          "ggraph",
          "ggrepel",
          "globals",
          "glue",
          "googledrive",
          "googlesheets4",
          "gower",
          "GPfit",
          "graphlayouts",
          "gridExtra",
          "gtable",
          "hardhat",
          "haven",
          "highr",
          "hms",
          "htmltools",
          "httr",
          "ids",
          "igraph",
          "infer",
          "ipred",
          "isoband",
          "iterators",
          "jquerylib",
          "jsonlite",
          "knitr",
          "labeling",
          "lava",
          "lhs",
          "lifecycle",
          "listenv",
          "lme4",
          "lubridate",
          "magrittr",
          "MatrixModels",
          "memoise",
          "mime",
          "minqa",
          "modeldata",
          "modelenv",
          "ModelMetrics",
          "modelr",
          "multcomp",
          "munsell",
          "mvtnorm",
          "nloptr",
          "numDeriv",
          "openssl",
          "parallelly",
          "parsnip",
          "patchwork",
          "pbkrtest",
          "pillar",
          "pkgbuild",
          "pkgconfig",
          "pkgload",
          "plyr",
          "polyclip",
          "praise",
          "prettyunits",
          "pROC",
          "processx",
          "prodlim",
          "progress",
          "progressr",
          "proxy",
          "ps",
          "purrr",
          "quantreg",
          "R6",
          "ragg",
          "rappdirs",
          "RColorBrewer",
          "Rcpp",
          "RcppArmadillo",
          "RcppEigen",
          "readr",
          "readxl",
          "recipes",
          "rematch",
          "rematch2",
          "reprex",
          "reshape2",
          "rjson",
          "rlang",
          "rmarkdown",
          "rprojroot",
          "rsample",
          "rstudioapi",
          "rvest",
          "sandwich",
          "sass",
          "scales",
          "selectr",
          "shape",
          "slider",
          "SparseM",
          "SQUAREM",
          "stringi",
          "stringr",
          "sys",
          "systemfonts",
          "testthat",
          "textshaping",
          "TH.data",
          "tibble",
          "tidygraph",
          "tidymodels",
          "tidyr",
          "tidyselect",
          "tidyverse",
          "timechange",
          "timeDate",